{
  "contract_version": "minerva-knowledge/1.0-draft",
  "snapshot_id": "0b1c2d3e-4f50-4617-8899-aabbccddeeff",
  "snapshot_seq": 1060,
  "source_instance_id": "dev-synthetic",
  "generation": "3f6c9a1e-5b2d-4c8e-9f10-2a3b4c5d6e7f",
  "created_at": "2026-10-20T09:10:00Z",
  "expires_at": "2026-10-21T09:10:00Z",
  "total": 3
}
